sentence1,sentence2,label,idx,sbert_ft_score,sbert_ft_pred
The charges allege that he was part of the conspiracy to kill and kidnap persons in a foreign country .,The government now charges that Sattar conspired with Rahman to kill and kidnap individuals in foreign countries .,1,543,0.5670558214187622,0
At least 27 US troops have been killed in hostile fire since Bush 's statement .,At least 26 American troops have been killed in hostile fire since major combat was officially declared over on May 1 .,1,1699,0.49624431133270264,0
"The broad Standard & Poor 's 500 < .SPX > eased 0.37 of a point , or 0.03 percent , at 1,121 .","The Standard & Poor 's 500 Index < .SPX > slipped 0.26 point , or 0.02 percent , to 1,121.96 .",1,2126,0.594934344291687,0
"Terri Schiavo , 39 , underwent the procedure at the Tampa Bay area hospice where she has been living for several years , said her father , Bob Schindler .","The tube was removed Wednesday from Terri Schiavo , 39 , at the Tampa Bay-area hospice where she has lived for several years .",1,2472,0.5156447887420654,0
The 12-nation currency has risen by 33 percent against the dollar over the past 15 months .,The euro is up 9 percent against the dollar in the past six weeks .,1,2827,0.2620299160480499,0
"But I would rather be talking about high standards than low standards . """,""" I would rather be talking about positive numbers rather than negative .",1,2994,0.510364830493927,0
Shares of Salix have rocketed 64 percent since Axcan made its first offer on April 10 .,"Since the initial takeover offer , Salix shares have risen about 35 percent .",1,3975,0.4362635314464569,0
"The jury verdict , reached Wednesday after less than four hours of deliberation , followed a 2 week trial , during which Waagner represented himself .","The quick conviction followed a 2 1 / 2 week trial , during which the Venango County man represented himself .",1,3989,0.48635566234588623,0
But plaque volume increased by 2.7 percent in pravastatin patients .,The volume of plaque in Pravachol patients ' arteries rose by 3 % .,1,4028,0.5852096080780029,0
